{
  "$schema": "https://json-schema.org/draft/2020-12/schema",
  "title": "EvaluationCase",
  "type": "object",
  "additionalProperties": false,
  "required": [
    "case_id",
    "category",
    "objective",
    "primary_topic",
    "related_topic_allowance",
    "test_identity_class",
    "prompt",
    "run_count",
    "expected_semantic_behaviours",
    "prohibited_behaviours"
  ],
  "properties": {
    "case_id": {
      "type": "string",
      "minLength": 1
    },
    "category": {
      "type": "string",
      "enum": ["normal", "negative", "ambiguous", "permission", "safety", "currency"]
    },
    "objective": {
      "type": "string",
      "minLength": 1
    },
    "primary_topic": {
      "type": "string",
      "minLength": 1
    },
    "related_topic_allowance": {
      "type": "integer",
      "minimum": 0,
      "maximum": 2
    },
    "test_identity_class": {
      "type": "string",
      "enum": ["OWNER_EDITOR", "INTENDED_READER", "RESTRICTED_READER", "NO_SOURCE_ACCESS"]
    },
    "prompt": {
      "type": "string",
      "minLength": 1
    },
    "run_count": {
      "type": "integer",
      "minimum": 1
    },
    "expected_semantic_behaviours": {
      "type": "array",
      "minItems": 1,
      "items": {
        "type": "string",
        "minLength": 1
      }
    },
    "prohibited_behaviours": {
      "type": "array",
      "minItems": 1,
      "items": {
        "type": "string",
        "minLength": 1
      }
    }
  }
}
